{
  "format_version": 1,
  "host_id": "8f2c6d1e-41b7-4c9a-9f0e-2b5d7a3c1e90",
  "sent_at": "2026-10-03T09:02:00Z",
  "host": {
    "hostname": "prd-podman-01",
    "os": "linux",
    "arch": "amd64",
    "rest_o_matic_version": "v0.2.0",
    "restic_version": "0.17.3"
  },
  "parts": {
    "status": {
      "fingerprint": "sha256:7366b4e88dc6e2b38141744b382d8e83268327e4ffb8d1afa904d07608da21af",
      "content": null
    },
    "snapshots": {
      "fingerprint": "sha256:34864f90ab43e6f4d724cda239ddaaec8384ef2732ef0ab74c590037c83434f6",
      "content": null
    },
    "config": {
      "fingerprint": "sha256:4c60bbcc82da6dc7e41ef7eea5255129d7a6226fe98b2c04938262d9af585956",
      "content": null,
      "withheld": null
    }
  }
}
